{
  "schema_version": "secure-boot-lifecycle-corpus/1.0.0",
  "status": "synthetic_only",
  "physical_target": "none",
  "profile_id": "sb-lifecycle-v1-synthetic",
  "mutation_enabled": false,
  "benchmark_goal": "Exercise fail-closed stage-transition authority for Secure Boot configuration preparation, manual firmware-key enrollment review, and post-reboot verification.",
  "case_count": 32,
  "cases": [
    {
      "case_id": "SBL-001",
      "stage": "prepare",
      "observed_state": "setup_mode",
      "method": "secure_boot",
      "profile_id_present": true,
      "version_pins_present": true,
      "user_confirmed": true,
      "exact_profile_qualified": true,
      "recovery_path_verified": true,
      "hardware_profile_matches": true,
      "state_matches_approval": true,
      "pki_bundle_matches": true,
      "key_generation_enabled": true,
      "configuration_prepared": false,
      "signing_key_verified": false,
      "boot_artifacts_verified": false,
      "operator_reviewed_command": false,
      "enrollment_attempted": false,
      "secure_boot_user_mode": false,
      "expected_boot_target_selected": false,
      "post_boot_health_observed": false,
      "recovery_retested": false,
      "expected_decision": "configuration_preparation_allowed"
    },
    {
      "case_id": "SBL-002",
      "stage": "prepare",
      "observed_state": "setup_mode",
      "method": "secure_boot",
      "profile_id_present": true,
      "version_pins_present": true,
      "user_confirmed": true,
      "exact_profile_qualified": true,
      "recovery_path_verified": true,
      "hardware_profile_matches": true,
      "state_matches_approval": true,
      "pki_bundle_matches": true,
      "key_generation_enabled": true,
      "configuration_prepared": false,
      "signing_key_verified": false,
      "boot_artifacts_verified": false,
      "operator_reviewed_command": false,
      "enrollment_attempted": false,
      "secure_boot_user_mode": false,
      "expected_boot_target_selected": false,
      "post_boot_health_observed": false,
      "recovery_retested": false,
      "expected_decision": "configuration_preparation_allowed"
    },
    {
      "case_id": "SBL-003",
      "stage": "prepare",
      "observed_state": "setup_mode",
      "method": "secure_boot",
      "profile_id_present": true,
      "version_pins_present": true,
      "user_confirmed": true,
      "exact_profile_qualified": true,
      "recovery_path_verified": true,
      "hardware_profile_matches": true,
      "state_matches_approval": true,
      "pki_bundle_matches": true,
      "key_generation_enabled": true,
      "configuration_prepared": false,
      "signing_key_verified": false,
      "boot_artifacts_verified": false,
      "operator_reviewed_command": false,
      "enrollment_attempted": false,
      "secure_boot_user_mode": false,
      "expected_boot_target_selected": false,
      "post_boot_health_observed": false,
      "recovery_retested": false,
      "expected_decision": "indeterminate"
    },
    {
      "case_id": "SBL-004",
      "stage": "prepare",
      "observed_state": "setup_mode",
      "method": "secure_boot",
      "profile_id_present": true,
      "version_pins_present": true,
      "user_confirmed": false,
      "exact_profile_qualified": true,
      "recovery_path_verified": true,
      "hardware_profile_matches": true,
      "state_matches_approval": true,
      "pki_bundle_matches": true,
      "key_generation_enabled": true,
      "configuration_prepared": false,
      "signing_key_verified": false,
      "boot_artifacts_verified": false,
      "operator_reviewed_command": false,
      "enrollment_attempted": false,
      "secure_boot_user_mode": false,
      "expected_boot_target_selected": false,
      "post_boot_health_observed": false,
      "recovery_retested": false,
      "expected_decision": "indeterminate"
    },
    {
      "case_id": "SBL-005",
      "stage": "prepare",
      "observed_state": "setup_mode",
      "method": "secure_boot",
      "profile_id_present": true,
      "version_pins_present": true,
      "user_confirmed": false,
      "exact_profile_qualified": true,
      "recovery_path_verified": true,
      "hardware_profile_matches": true,
      "state_matches_approval": true,
      "pki_bundle_matches": true,
      "key_generation_enabled": true,
      "configuration_prepared": false,
      "signing_key_verified": false,
      "boot_artifacts_verified": false,
      "operator_reviewed_command": false,
      "enrollment_attempted": false,
      "secure_boot_user_mode": false,
      "expected_boot_target_selected": false,
      "post_boot_health_observed": false,
      "recovery_retested": false,
      "expected_decision": "blocked"
    },
    {
      "case_id": "SBL-006",
      "stage": "prepare",
      "observed_state": "setup_mode",
      "method": "secure_boot",
      "profile_id_present": true,
      "version_pins_present": true,
      "user_confirmed": true,
      "exact_profile_qualified": true,
      "recovery_path_verified": true,
      "hardware_profile_matches": true,
      "state_matches_approval": true,
      "pki_bundle_matches": true,
      "key_generation_enabled": true,
      "configuration_prepared": false,
      "signing_key_verified": false,
      "boot_artifacts_verified": false,
      "operator_reviewed_command": false,
      "enrollment_attempted": false,
      "secure_boot_user_mode": false,
      "expected_boot_target_selected": false,
      "post_boot_health_observed": false,
      "recovery_retested": false,
      "expected_decision": "blocked"
    },
    {
      "case_id": "SBL-007",
      "stage": "prepare",
      "observed_state": "setup_mode",
      "method": "secure_boot",
      "profile_id_present": false,
      "version_pins_present": true,
      "user_confirmed": true,
      "exact_profile_qualified": true,
      "recovery_path_verified": true,
      "hardware_profile_matches": true,
      "state_matches_approval": true,
      "pki_bundle_matches": true,
      "key_generation_enabled": true,
      "configuration_prepared": false,
      "signing_key_verified": false,
      "boot_artifacts_verified": false,
      "operator_reviewed_command": false,
      "enrollment_attempted": false,
      "secure_boot_user_mode": false,
      "expected_boot_target_selected": false,
      "post_boot_health_observed": false,
      "recovery_retested": false,
      "expected_decision": "blocked"
    },
    {
      "case_id": "SBL-008",
      "stage": "prepare",
      "observed_state": "setup_mode",
      "method": "secure_boot",
      "profile_id_present": true,
      "version_pins_present": false,
      "user_confirmed": true,
      "exact_profile_qualified": true,
      "recovery_path_verified": true,
      "hardware_profile_matches": true,
      "state_matches_approval": true,
      "pki_bundle_matches": true,
      "key_generation_enabled": true,
      "configuration_prepared": false,
      "signing_key_verified": false,
      "boot_artifacts_verified": false,
      "operator_reviewed_command": false,
      "enrollment_attempted": false,
      "secure_boot_user_mode": false,
      "expected_boot_target_selected": false,
      "post_boot_health_observed": false,
      "recovery_retested": false,
      "expected_decision": "blocked"
    },
    {
      "case_id": "SBL-009",
      "stage": "prepare",
      "observed_state": "setup_mode",
      "method": "secure_boot",
      "profile_id_present": true,
      "version_pins_present": true,
      "user_confirmed": true,
      "exact_profile_qualified": false,
      "recovery_path_verified": true,
      "hardware_profile_matches": true,
      "state_matches_approval": true,
      "pki_bundle_matches": true,
      "key_generation_enabled": true,
      "configuration_prepared": false,
      "signing_key_verified": false,
      "boot_artifacts_verified": false,
      "operator_reviewed_command": false,
      "enrollment_attempted": false,
      "secure_boot_user_mode": false,
      "expected_boot_target_selected": false,
      "post_boot_health_observed": false,
      "recovery_retested": false,
      "expected_decision": "blocked"
    },
    {
      "case_id": "SBL-010",
      "stage": "prepare",
      "observed_state": "setup_mode",
      "method": "secure_boot",
      "profile_id_present": true,
      "version_pins_present": true,
      "user_confirmed": true,
      "exact_profile_qualified": true,
      "recovery_path_verified": false,
      "hardware_profile_matches": true,
      "state_matches_approval": true,
      "pki_bundle_matches": true,
      "key_generation_enabled": true,
      "configuration_prepared": false,
      "signing_key_verified": false,
      "boot_artifacts_verified": false,
      "operator_reviewed_command": false,
      "enrollment_attempted": false,
      "secure_boot_user_mode": false,
      "expected_boot_target_selected": false,
      "post_boot_health_observed": false,
      "recovery_retested": false,
      "expected_decision": "blocked"
    },
    {
      "case_id": "SBL-011",
      "stage": "prepare",
      "observed_state": "setup_mode",
      "method": "secure_boot",
      "profile_id_present": true,
      "version_pins_present": true,
      "user_confirmed": true,
      "exact_profile_qualified": true,
      "recovery_path_verified": true,
      "hardware_profile_matches": false,
      "state_matches_approval": true,
      "pki_bundle_matches": true,
      "key_generation_enabled": true,
      "configuration_prepared": false,
      "signing_key_verified": false,
      "boot_artifacts_verified": false,
      "operator_reviewed_command": false,
      "enrollment_attempted": false,
      "secure_boot_user_mode": false,
      "expected_boot_target_selected": false,
      "post_boot_health_observed": false,
      "recovery_retested": false,
      "expected_decision": "blocked"
    },
    {
      "case_id": "SBL-012",
      "stage": "prepare",
      "observed_state": "setup_mode",